Tool,Severity,Code,Location,Line
semgrep,warning,"generic.secrets.security.detected-aws-access-key-id-value.detected-aws-access-key-id-value AWS Access Key ID Value detected. This is a sensitive credential and should not be hardcoded here. Instead, read this value from an environment variable or keep it in a separate, private file.",.aws/credentials,2
semgrep,warning,generic.secrets.security.detected-aws-secret-access-key.detected-aws-secret-access-key AWS Secret Access Key detected,.aws/credentials,3
semgrep,warning,generic.secrets.security.detected-aws-session-token.detected-aws-session-token AWS Session Token detected,.aws/credentials,4
semgrep,warning,"python.lang.security.audit.eval-detected.eval-detected Detected the use of eval(). eval() can be dangerous if used to evaluate dynamic content. If this content can be input from outside the program, this may be a code injection vulnerability. Ensure evaluated content is not definable by external sources.",src1/command-injection-1.py,5
semgrep,warning,"python.lang.security.audit.subprocess-shell-true.subprocess-shell-true Found 'subprocess' function 'Popen' with 'shell=True'. This is dangerous because this call will spawn the command using a shell process. Doing so propagates current shell settings and variables, which makes it much easier for a malicious actor to execute commands. Use 'shell=False' instead.",src1/command-injection-2.py,6
